{
  "$schema": "https://json-schema.org/draft/2020-12/schema",
  "$id": "com.routeware.eventbus.EncoreRouteCreated",
  "type": "object",
  "default": {},
  "title": "Schema for EncoreRouteCreated event",
  "required": [
    "MessageType",
    "UUID",
    "as_of",
    "URL"
  ],
  "properties": {
    "MessageType": {
      "type": "string",
      "default": "",
      "title": "The Message Type, which should be Route",
      "examples": [
        "Route"
      ]
    },
    "UUID": {
      "type": "string",
      "default": "",
      "title": "Unique ID of the event",
      "examples": [
        "dee3f3f9-ca7f-4eee-bf32-ad2efc58f3a9"
      ]
    },
    "as_of": {
      "type": "string",
      "default": "",
      "title": "The time in DateTimeOffset format the event was created",
      "examples": [
        "2022-11-08T11:22:14.0445446-05:00"
      ]
    },
    "URL": {
      "type": "string",
      "default": "",
      "title": "URL Linking to the Detailed schema in blob storage; EncoreRouteDetailCreated",
      "examples": [
        "https://corerccintegration.blob.core.windows.net/integrationjson/dee3f3f9-ca7f-4eee-bf32-ad2efc58f3a9.json?sv=2021-08-06\u0026se=2022-11-08T16%3A27%3A14Z\u0026sr=b\u0026sp=r\u0026sig=%2F9t0NdXI3FsJieuhF4CTQMo71gWMJnpau0kJEOz1IXA%3D"
      ]
    }
  },
  "examples": [
    {
      "MessageType": "Route",
      "UUID": "dee3f3f9-ca7f-4eee-bf32-ad2efc58f3a9",
      "as_of": "2022-11-08T11:22:14.0445446-05:00",
      "URL": "https://corerccintegration.blob.core.windows.net/integrationjson/dee3f3f9-ca7f-4eee-bf32-ad2efc58f3a9.json?sv=2021-08-06\u0026se=2022-11-08T16%3A27%3A14Z\u0026sr=b\u0026sp=r\u0026sig=%2F9t0NdXI3FsJieuhF4CTQMo71gWMJnpau0kJEOz1IXA%3D"
    }
  ]
}